{
  "schemaVersion": "sacs-v06-acceptance-ledger/1.0",
  "sourceSha": "0cce422873f69df1ea7b78f72067dcd48e3c6b51",
  "updatedAt": "2026-09-06T06:27:12.635Z",
  "rows": [
    {
      "id": "V06-S00-001",
      "status": "PASS",
      "evidenceRefs": [
        "SOURCE_LOCK.json",
        "S00.json"
      ]
    },
    {
      "id": "V06-S00-002",
      "status": "PASS",
      "evidenceRefs": [
        "SOURCE_LOCK.json",
        "S00.json"
      ]
    },
    {
      "id": "V06-S00-003",
      "status": "PASS",
      "evidenceRefs": [
        "SOURCE_LOCK.json",
        "S00.json"
      ]
    },
    {
      "id": "V06-S00-004",
      "status": "PASS",
      "evidenceRefs": [
        "SOURCE_LOCK.json",
        "S00.json"
      ]
    },
    {
      "id": "V06-S00-005",
      "status": "PASS",
      "evidenceRefs": [
        "SOURCE_LOCK.json",
        "S00.json"
      ]
    },
    {
      "id": "V06-S00-006",
      "status": "PASS",
      "evidenceRefs": [
        "SOURCE_LOCK.json",
        "S00.json"
      ]
    },
    {
      "id": "V06-S00-007",
      "status": "PASS",
      "evidenceRefs": [
        "SOURCE_LOCK.json",
        "S00.json"
      ]
    },
    {
      "id": "V06-S00-008",
      "status": "PASS",
      "evidenceRefs": [
        "SOURCE_LOCK.json",
        "S00.json"
      ]
    },
    {
      "id": "V06-S00-009",
      "status": "PASS",
      "evidenceRefs": [
        "SOURCE_LOCK.json",
        "S00.json"
      ]
    },
    {
      "id": "V06-S00-010",
      "status": "PASS",
      "evidenceRefs": [
        "SOURCE_LOCK.json",
        "S00.json"
      ]
    },
    {
      "id": "V06-S01-001",
      "status": "PASS",
      "evidenceRefs": [
        "S01.json",
        "tests/v06-analysis-source.contract.test.ts"
      ]
    },
    {
      "id": "V06-S01-002",
      "status": "PASS",
      "evidenceRefs": [
        "S01.json",
        "tests/v06-analysis-source.contract.test.ts"
      ]
    },
    {
      "id": "V06-S01-003",
      "status": "PASS",
      "evidenceRefs": [
        "S01.json",
        "packages/analysis-contract/src/source.ts"
      ]
    },
    {
      "id": "V06-S01-004",
      "status": "PASS",
      "evidenceRefs": [
        "S01.json",
        "tests/v06-source-bridge.unit.test.ts"
      ]
    },
    {
      "id": "V06-S01-005",
      "status": "PASS",
      "evidenceRefs": [
        "S01.json",
        "tests/v06-source-bridge.unit.test.ts"
      ]
    },
    {
      "id": "V06-S01-006",
      "status": "PASS",
      "evidenceRefs": [
        "S01.json",
        "tests/v06-source-persistence.postgres.int.test.ts"
      ]
    },
    {
      "id": "V06-S01-007",
      "status": "PASS",
      "evidenceRefs": [
        "S01.json",
        "tests/v06-source-persistence.postgres.int.test.ts"
      ]
    },
    {
      "id": "V06-S01-008",
      "status": "PASS",
      "evidenceRefs": [
        "S01.json",
        "migrations/0017_analysis_source_identity.sql"
      ]
    },
    {
      "id": "V06-S01-009",
      "status": "PASS",
      "evidenceRefs": [
        "S01.json",
        "tests/v06-source-persistence.postgres.int.test.ts"
      ]
    },
    {
      "id": "V06-S01-010",
      "status": "PASS",
      "evidenceRefs": [
        "S01.json",
        "tests/analysis-persistence.postgres.int.test.ts"
      ]
    },
    {
      "id": "V06-S01-011",
      "status": "PASS",
      "evidenceRefs": [
        "S01.json",
        "tests/v06-source-persistence.postgres.int.test.ts"
      ]
    },
    {
      "id": "V06-S01-012",
      "status": "PASS",
      "evidenceRefs": [
        "S01.json",
        "tests/v06-analysis-source.contract.test.ts"
      ]
    },
    {
      "id": "V06-S02-001",
      "status": "NOT_RUN",
      "evidenceRefs": []
    },
    {
      "id": "V06-S02-002",
      "status": "NOT_RUN",
      "evidenceRefs": []
    },
    {
      "id": "V06-S02-003",
      "status": "NOT_RUN",
      "evidenceRefs": []
    },
    {
      "id": "V06-S02-004",
      "status": "NOT_RUN",
      "evidenceRefs": []
    },
    {
      "id": "V06-S02-005",
      "status": "NOT_RUN",
      "evidenceRefs": []
    },
    {
      "id": "V06-S02-006",
      "status": "NOT_RUN",
      "evidenceRefs": []
    },
    {
      "id": "V06-S02-007",
      "status": "NOT_RUN",
      "evidenceRefs": []
    },
    {
      "id": "V06-S02-008",
      "status": "NOT_RUN",
      "evidenceRefs": []
    },
    {
      "id": "V06-S02-009",
      "status": "NOT_RUN",
      "evidenceRefs": []
    },
    {
      "id": "V06-S02-010",
      "status": "NOT_RUN",
      "evidenceRefs": []
    },
    {
      "id": "V06-S02-011",
      "status": "NOT_RUN",
      "evidenceRefs": []
    },
    {
      "id": "V06-S02-012",
      "status": "NOT_RUN",
      "evidenceRefs": []
    },
    {
      "id": "V06-S02-013",
      "status": "NOT_RUN",
      "evidenceRefs": []
    },
    {
      "id": "V06-S02-014",
      "status": "NOT_RUN",
      "evidenceRefs": []
    },
    {
      "id": "V06-S03-001",
      "status": "NOT_RUN",
      "evidenceRefs": []
    },
    {
      "id": "V06-S03-002",
      "status": "NOT_RUN",
      "evidenceRefs": []
    },
    {
      "id": "V06-S03-003",
      "status": "NOT_RUN",
      "evidenceRefs": []
    },
    {
      "id": "V06-S03-004",
      "status": "NOT_RUN",
      "evidenceRefs": []
    },
    {
      "id": "V06-S03-005",
      "status": "NOT_RUN",
      "evidenceRefs": []
    },
    {
      "id": "V06-S03-006",
      "status": "NOT_RUN",
      "evidenceRefs": []
    },
    {
      "id": "V06-S03-007",
      "status": "NOT_RUN",
      "evidenceRefs": []
    },
    {
      "id": "V06-S03-008",
      "status": "NOT_RUN",
      "evidenceRefs": []
    },
    {
      "id": "V06-S03-009",
      "status": "NOT_RUN",
      "evidenceRefs": []
    },
    {
      "id": "V06-S03-010",
      "status": "NOT_RUN",
      "evidenceRefs": []
    },
    {
      "id": "V06-S03-011",
      "status": "NOT_RUN",
      "evidenceRefs": []
    },
    {
      "id": "V06-S03-012",
      "status": "NOT_RUN",
      "evidenceRefs": []
    },
    {
      "id": "V06-S03-013",
      "status": "NOT_RUN",
      "evidenceRefs": []
    },
    {
      "id": "V06-S04-001",
      "status": "NOT_RUN",
      "evidenceRefs": []
    },
    {
      "id": "V06-S04-002",
      "status": "NOT_RUN",
      "evidenceRefs": []
    },
    {
      "id": "V06-S04-003",
      "status": "NOT_RUN",
      "evidenceRefs": []
    },
    {
      "id": "V06-S04-004",
      "status": "NOT_RUN",
      "evidenceRefs": []
    },
    {
      "id": "V06-S04-005",
      "status": "NOT_RUN",
      "evidenceRefs": []
    },
    {
      "id": "V06-S04-006",
      "status": "NOT_RUN",
      "evidenceRefs": []
    },
    {
      "id": "V06-S04-007",
      "status": "NOT_RUN",
      "evidenceRefs": []
    },
    {
      "id": "V06-S04-008",
      "status": "NOT_RUN",
      "evidenceRefs": []
    },
    {
      "id": "V06-S04-009",
      "status": "NOT_RUN",
      "evidenceRefs": []
    },
    {
      "id": "V06-S04-010",
      "status": "NOT_RUN",
      "evidenceRefs": []
    },
    {
      "id": "V06-S04-011",
      "status": "NOT_RUN",
      "evidenceRefs": []
    },
    {
      "id": "V06-S04-012",
      "status": "NOT_RUN",
      "evidenceRefs": []
    },
    {
      "id": "V06-S04-013",
      "status": "NOT_RUN",
      "evidenceRefs": []
    },
    {
      "id": "V06-S04-014",
      "status": "NOT_RUN",
      "evidenceRefs": []
    },
    {
      "id": "V06-S05-001",
      "status": "NOT_RUN",
      "evidenceRefs": []
    },
    {
      "id": "V06-S05-002",
      "status": "NOT_RUN",
      "evidenceRefs": []
    },
    {
      "id": "V06-S05-003",
      "status": "NOT_RUN",
      "evidenceRefs": []
    },
    {
      "id": "V06-S05-004",
      "status": "NOT_RUN",
      "evidenceRefs": []
    },
    {
      "id": "V06-S05-005",
      "status": "NOT_RUN",
      "evidenceRefs": []
    },
    {
      "id": "V06-S05-006",
      "status": "NOT_RUN",
      "evidenceRefs": []
    },
    {
      "id": "V06-S05-007",
      "status": "NOT_RUN",
      "evidenceRefs": []
    },
    {
      "id": "V06-S05-008",
      "status": "NOT_RUN",
      "evidenceRefs": []
    },
    {
      "id": "V06-S05-009",
      "status": "NOT_RUN",
      "evidenceRefs": []
    },
    {
      "id": "V06-S05-010",
      "status": "NOT_RUN",
      "evidenceRefs": []
    },
    {
      "id": "V06-S05-011",
      "status": "NOT_RUN",
      "evidenceRefs": []
    },
    {
      "id": "V06-S05-012",
      "status": "NOT_RUN",
      "evidenceRefs": []
    },
    {
      "id": "V06-S05-013",
      "status": "NOT_RUN",
      "evidenceRefs": []
    },
    {
      "id": "V06-S05-014",
      "status": "NOT_RUN",
      "evidenceRefs": []
    },
    {
      "id": "V06-S05-015",
      "status": "NOT_RUN",
      "evidenceRefs": []
    },
    {
      "id": "V06-S06-001",
      "status": "NOT_RUN",
      "evidenceRefs": []
    },
    {
      "id": "V06-S06-002",
      "status": "NOT_RUN",
      "evidenceRefs": []
    },
    {
      "id": "V06-S06-003",
      "status": "NOT_RUN",
      "evidenceRefs": []
    },
    {
      "id": "V06-S06-004",
      "status": "NOT_RUN",
      "evidenceRefs": []
    },
    {
      "id": "V06-S06-005",
      "status": "NOT_RUN",
      "evidenceRefs": []
    },
    {
      "id": "V06-S06-006",
      "status": "NOT_RUN",
      "evidenceRefs": []
    },
    {
      "id": "V06-S06-007",
      "status": "NOT_RUN",
      "evidenceRefs": []
    },
    {
      "id": "V06-S06-008",
      "status": "NOT_RUN",
      "evidenceRefs": []
    },
    {
      "id": "V06-S06-009",
      "status": "NOT_RUN",
      "evidenceRefs": []
    },
    {
      "id": "V06-S06-010",
      "status": "NOT_RUN",
      "evidenceRefs": []
    },
    {
      "id": "V06-S06-011",
      "status": "NOT_RUN",
      "evidenceRefs": []
    },
    {
      "id": "V06-S06-012",
      "status": "NOT_RUN",
      "evidenceRefs": []
    },
    {
      "id": "V06-S06-013",
      "status": "NOT_RUN",
      "evidenceRefs": []
    },